{
  "schema_version": 1,
  "profile_name": "EPSON_ZaimuKaikeiR4_45col",
  "width": 45,
  "header_rows": 1,
  "reject_blank_records": true,
  "expected_header_rows": [
    [
      "月種別",
      "種類",
      "形式",
      "作成方法",
      "付箋",
      "伝票日付",
      "伝票番号",
      "伝票摘要",
      "枝番",
      "借方部門",
      "借方部門名",
      "借方科目",
      "借方科目名",
      "借方補助",
      "借方補助科目名",
      "借方金額",
      "借方消費税コード",
      "借方消費税業種",
      "借方消費税税率",
      "借方資金区分",
      "借方任意項目１",
      "借方任意項目２",
      "借方インボイス情報",
      "貸方部門",
      "貸方部門名",
      "貸方科目",
      "貸方科目名",
      "貸方補助",
      "貸方補助科目名",
      "貸方金額",
      "貸方消費税コード",
      "貸方消費税業種",
      "貸方消費税税率",
      "貸方資金区分",
      "貸方任意項目１",
      "貸方任意項目２",
      "貸方インボイス情報",
      "摘要",
      "期日",
      "証番号",
      "入力マシン",
      "入力ユーザ",
      "入力アプリ",
      "入力会社",
      "入力日付"
    ]
  ],
  "uadc": {
    "encoding": "utf-8",
    "bom": "forbidden",
    "newline": "LF",
    "final_newline": true,
    "delimiter": ",",
    "quote_policy": "minimal"
  },
  "date_transforms": [
    {
      "column": "C6",
      "application_format": "YYYY/MM/DD",
      "uadc_format": "YYYY-MM-DD"
    },
    {
      "column": "C39",
      "application_format": "YYYY/MM/DD",
      "uadc_format": "YYYY-MM-DD"
    },
    {
      "column": "C45",
      "application_format": "YYYY/MM/DD",
      "uadc_format": "YYYY-MM-DD"
    }
  ],
  "application_input": {
    "encoding": "cp932",
    "bom": "forbidden",
    "newline": "CRLF",
    "final_newline": true,
    "delimiter": ",",
    "quote_policy": "minimal"
  },
  "application_output": {
    "encoding": "cp932",
    "bom": "forbidden",
    "newline": "CRLF",
    "final_newline": true,
    "delimiter": ",",
    "quote_policy": "minimal"
  },
  "numeric_transforms": [
    {
      "column": "C16",
      "application_input_grouping": ",",
      "uadc_grouping": "",
      "application_output_grouping": ""
    },
    {
      "column": "C30",
      "application_input_grouping": ",",
      "uadc_grouping": "",
      "application_output_grouping": ""
    }
  ]
}
